{
  "schemaVersion" : "1.1",
  "reportId" : "report_e5b5b9ab-647e-4941-9c81-e21c6fb2166d",
  "subject" : {
    "projectId" : "library",
    "moduleId" : null,
    "mapperPath" : "fixtures/library/mapper/LoanMapper.xml",
    "namespace" : "library.LoanMapper",
    "statementId" : "findOverdueLoans",
    "statementType" : "SELECT",
    "contentHash" : "c379d4fbf228439f6d560686dc82cb21b7c071a4a549277f1f3e191acb7b6546",
    "mybatisVersion" : null
  },
  "summary" : {
    "severity" : "HIGH",
    "headline" : "缺少主分片键导致跨分片扫描（共 2 项风险，10 个场景）",
    "primaryBottlenecks" : [ "缺少主分片键导致跨分片扫描", "缺少二级分片时间范围，扩大时间分区扫描" ],
    "impactScope" : "10 个动态 SQL 场景，覆盖 2 张引用表",
    "confidence" : 0.85
  },
  "businessSemantics" : [ {
    "fact" : "表 loan（借阅记录）：一次借阅生命周期",
    "structured" : {
      "datasource" : "library_db",
      "schema" : "public",
      "owner" : "alice",
      "dataDomain" : "借阅"
    },
    "evidence" : {
      "sourceType" : "EXCEL_PUBLISHED",
      "sourceId" : "ks_5180bace-ba8e-4dfb-9e15-a9468406cb37",
      "version" : 1,
      "locator" : "tables!row5",
      "collectedAt" : "2026-07-27T06:25:59.055053Z",
      "confidence" : 0.9
    }
  }, {
    "fact" : "字段 loan.status：借阅状态",
    "structured" : {
      "dataType" : "varchar",
      "enumDomain" : "LOAN_STATUS",
      "sensitive" : false,
      "required" : true,
      "sensitivityPolicy" : "PLAINTEXT"
    },
    "evidence" : {
      "sourceType" : "EXCEL_PUBLISHED",
      "sourceId" : "ks_5180bace-ba8e-4dfb-9e15-a9468406cb37",
      "version" : 1,
      "locator" : "columns!row8",
      "collectedAt" : "2026-07-27T06:25:59.055053Z",
      "confidence" : 0.9
    }
  }, {
    "fact" : "字段 loan.borrowed_at：借出时间（二级分片键）",
    "structured" : {
      "dataType" : "timestamp",
      "sensitive" : false,
      "required" : true,
      "sensitivityPolicy" : "PLAINTEXT"
    },
    "evidence" : {
      "sourceType" : "EXCEL_PUBLISHED",
      "sourceId" : "ks_5180bace-ba8e-4dfb-9e15-a9468406cb37",
      "version" : 1,
      "locator" : "columns!row9",
      "collectedAt" : "2026-07-27T06:25:59.055053Z",
      "confidence" : 0.9
    }
  }, {
    "fact" : "字段 loan.due_at：应还时间（逾期判定基准）",
    "structured" : {
      "dataType" : "timestamp",
      "sensitive" : false,
      "required" : true,
      "sensitivityPolicy" : "PLAINTEXT"
    },
    "evidence" : {
      "sourceType" : "EXCEL_PUBLISHED",
      "sourceId" : "ks_5180bace-ba8e-4dfb-9e15-a9468406cb37",
      "version" : 1,
      "locator" : "columns!row10",
      "collectedAt" : "2026-07-27T06:25:59.055053Z",
      "confidence" : 0.9
    }
  }, {
    "fact" : "活跃借阅的 returned_at 必须为空（约束：loan.status = 'ACTIVE' => loan.returned_at IS NULL）",
    "structured" : {
      "target" : "loan",
      "priority" : 10
    },
    "evidence" : {
      "sourceType" : "EXCEL_PUBLISHED",
      "sourceId" : "ks_5180bace-ba8e-4dfb-9e15-a9468406cb37",
      "version" : 1,
      "locator" : "rules!row3",
      "collectedAt" : "2026-07-27T06:25:59.055053Z",
      "confidence" : 0.9
    }
  }, {
    "fact" : "逾期定义：ACTIVE 且 due_at 早于当前时间（约束：loan.status = 'ACTIVE' AND loan.due_at < now）",
    "structured" : {
      "target" : "loan",
      "priority" : 10
    },
    "evidence" : {
      "sourceType" : "EXCEL_PUBLISHED",
      "sourceId" : "ks_5180bace-ba8e-4dfb-9e15-a9468406cb37",
      "version" : 1,
      "locator" : "rules!row4",
      "collectedAt" : "2026-07-27T06:25:59.055053Z",
      "confidence" : 0.9
    }
  }, {
    "fact" : "索引 idx_loan_member_status_due(member_id,status,due_at)，来源 MANUAL",
    "structured" : {
      "columnsJson" : "[{\"column\":\"member_id\",\"direction\":\"ASC\"},{\"column\":\"status\",\"direction\":\"ASC\"},{\"column\":\"due_at\",\"direction\":\"ASC\"}]",
      "indexType" : "NORMAL"
    },
    "evidence" : {
      "sourceType" : "MANUAL_RULE",
      "sourceId" : "idx_9d294aad-c414-4ba0-8a77-af5b00c18c40",
      "version" : 1,
      "locator" : "loan",
      "collectedAt" : "2026-07-27T06:25:59.057379Z",
      "confidence" : 0.95
    }
  }, {
    "fact" : "分片 loan：主分片键 member_id，二级分片键 borrowed_at，来源 MANUAL",
    "structured" : {
      "shardKey" : "member_id",
      "secondaryShardKey" : "borrowed_at"
    },
    "evidence" : {
      "sourceType" : "MANUAL_RULE",
      "sourceId" : "shard_8e50f32e-742f-4988-aaad-197ad3ae11bc",
      "version" : 2,
      "locator" : "loan",
      "collectedAt" : "2026-07-27T06:25:59.059318Z",
      "confidence" : 0.95
    }
  }, {
    "fact" : "表 book_copy（馆藏副本）：某分馆中某书目的一本实体副本",
    "structured" : {
      "datasource" : "library_db",
      "schema" : "public",
      "owner" : "alice",
      "dataDomain" : "图书"
    },
    "evidence" : {
      "sourceType" : "EXCEL_PUBLISHED",
      "sourceId" : "ks_5180bace-ba8e-4dfb-9e15-a9468406cb37",
      "version" : 1,
      "locator" : "tables!row3",
      "collectedAt" : "2026-07-27T06:25:59.055053Z",
      "confidence" : 0.9
    }
  }, {
    "fact" : "字段 book_copy.status：副本状态",
    "structured" : {
      "dataType" : "varchar",
      "enumDomain" : "COPY_STATUS",
      "sensitive" : false,
      "required" : true,
      "sensitivityPolicy" : "PLAINTEXT"
    },
    "evidence" : {
      "sourceType" : "EXCEL_PUBLISHED",
      "sourceId" : "ks_5180bace-ba8e-4dfb-9e15-a9468406cb37",
      "version" : 1,
      "locator" : "columns!row5",
      "collectedAt" : "2026-07-27T06:25:59.055053Z",
      "confidence" : 0.9
    }
  }, {
    "fact" : "仅 AVAILABLE 副本才能新建借阅（约束：book_copy.status = 'AVAILABLE'）",
    "structured" : {
      "target" : "book_copy",
      "priority" : 10
    },
    "evidence" : {
      "sourceType" : "EXCEL_PUBLISHED",
      "sourceId" : "ks_5180bace-ba8e-4dfb-9e15-a9468406cb37",
      "version" : 1,
      "locator" : "rules!row2",
      "collectedAt" : "2026-07-27T06:25:59.055053Z",
      "confidence" : 0.9
    }
  } ],
  "scenarios" : [ {
    "scenarioId" : "scn_main-path_d6390e19",
    "name" : "业务主路径",
    "businessDescription" : "必填参数齐备的典型业务调用",
    "parameterSource" : "RULE_INFERRED",
    "parameters" : {
      "memberId" : 1,
      "branchId" : 1,
      "dueBefore" : "2026-01-01",
      "borrowedFrom" : "2026-01-01",
      "borrowedTo" : "2026-01-01",
      "statuses" : [ "item_1" ]
    },
    "expectedBranches" : [ "findOverdueLoans#where[0]/if[0]:true", "findOverdueLoans#where[0]/if[1]:true", "findOverdueLoans#where[0]/if[2]:true", "findOverdueLoans#where[0]/if[3]:true", "findOverdueLoans#where[0]/if[4]:true", "findOverdueLoans#where[0]/if[5]:true" ],
    "boundSql" : "SELECT l.id, l.member_id, l.copy_id, l.borrowed_at, l.due_at, l.status\n        FROM loan l\n         WHERE l.status = 'ACTIVE'\n            AND l.due_at < ?\n            \n                AND l.member_id = ?\n            \n            \n                AND l.copy_id IN (SELECT id FROM book_copy WHERE branch_id = ?)\n            \n            \n                AND l.due_at < ?\n            \n            \n                AND l.borrowed_at >= ?\n            \n            \n                AND l.borrowed_at < ?\n            \n            \n                AND l.status IN\n                (\n                    ?\n                ) \n        ORDER BY l.due_at",
    "sqlFingerprint" : "a3d64a221c5f0977",
    "parameterMappings" : [ {
      "property" : "asOf",
      "mode" : "IN",
      "javaType" : "java.lang.Object",
      "jdbcType" : null
    }, {
      "property" : "memberId",
      "mode" : "IN",
      "javaType" : "java.lang.Object",
      "jdbcType" : null
    }, {
      "property" : "branchId",
      "mode" : "IN",
      "javaType" : "java.lang.Object",
      "jdbcType" : null
    }, {
      "property" : "dueBefore",
      "mode" : "IN",
      "javaType" : "java.lang.Object",
      "jdbcType" : null
    }, {
      "property" : "borrowedFrom",
      "mode" : "IN",
      "javaType" : "java.lang.Object",
      "jdbcType" : null
    }, {
      "property" : "borrowedTo",
      "mode" : "IN",
      "javaType" : "java.lang.Object",
      "jdbcType" : null
    }, {
      "property" : "__frch_st_0",
      "mode" : "IN",
      "javaType" : "java.lang.String",
      "jdbcType" : null
    } ],
    "additionalParameters" : {
      "__frch_st_0" : "item_1"
    },
    "coverage" : [ "findOverdueLoans#where[0]/if[0]", "findOverdueLoans#where[0]/if[1]", "findOverdueLoans#where[0]/if[2]", "findOverdueLoans#where[0]/if[3]", "findOverdueLoans#where[0]/if[4]", "findOverdueLoans#where[0]/if[5]", "findOverdueLoans#where[0]/if[5]/foreach[0]" ],
    "hasDollarInterpolation" : false,
    "unsupported" : null,
    "confidence" : 0.9,
    "knowledgeVersion" : "图书业务知识@1",
    "profileSnapshotId" : "snap_e2e_ea52c577-b84f-4e0c-8295-b0691a9c94ee",
    "coverageGoals" : [ "IF_TRUE@findOverdueLoans#where[0]/if[0]", "IF_TRUE@findOverdueLoans#where[0]/if[1]", "IF_TRUE@findOverdueLoans#where[0]/if[2]", "IF_TRUE@findOverdueLoans#where[0]/if[3]", "IF_TRUE@findOverdueLoans#where[0]/if[4]", "IF_TRUE@findOverdueLoans#where[0]/if[5]", "FOREACH_SINGLE@findOverdueLoans#where[0]/if[5]/foreach[0]", "SHARD_SINGLE", "ENUM_UNKNOWN@dueBefore", "ENUM_HIGH@statuses", "ENUM_LOW@statuses", "ENUM_UNKNOWN@statuses", "RANGE_MIN@dueBefore", "RANGE_P50@dueBefore" ],
    "evidenceIds" : [ "ev_d9e5dcf94db7f25e026c7273", "ev_4ed777c8c496443b16c50324", "ev_d0cbcd044c5d4164f44d6f1b", "ev_d54765922456cf5baf43819b", "ev_578885ba3d352b9a2a07454b", "ev_85f4bc1b4418a5196b27f98a", "ev_0b087340b41d15730c1d3cd9", "ev_48b1c3f6b7141c275dcf116c", "ev_82cdbd4cbe4c8e440dcaa0dd", "ev_8510f51dbbef476026adbfc6", "ev_84c45ca7a304b137448538a7", "ev_254a5f24523c9c5b9cd37036", "ev_50ea2aaba878df1fc937f06d", "ev_de0742c45eb0d387b0660e00" ],
    "reason" : "必填参数齐备的典型业务调用"
  }, {
    "scenarioId" : "scn_foreach-statuses-0_1979fa84",
    "name" : "foreach(statuses) 空集合",
    "businessDescription" : "foreach 集合规模场景：空集合（不复制真实大集合）",
    "parameterSource" : "BOUNDARY_GENERATED",
    "parameters" : {
      "memberId" : 1,
      "branchId" : 1,
      "dueBefore" : "2026-01-01",
      "borrowedFrom" : "2026-01-01",